{
  "$schema": "http://json-schema.org/draft-07/schema#",
  "title": "CardStatementImport",
  "description": "Schema for card statement import - initial AI extraction output",
  "type": "object",
  "required": ["statementId", "source", "summary", "sections", "groups", "rows", "futureInstallmentsBlock"],
  "properties": {
    "statementId": { "type": ["string", "null"] },
    "source": {
      "type": "object",
      "required": ["bankName", "brand", "statementNumber", "pageCount"],
      "properties": {
        "bankName": { "type": ["string", "null"] },
        "brand": { "type": ["string", "null"] },
        "statementNumber": { "type": ["string", "null"] },
        "pageCount": { "type": "number" }
      }
    },
    "summary": {
      "type": "object",
      "required": ["totalPesos", "totalDollars", "minimumPaymentPesos", "currentDueDate", "nextClosingDate", "nextDueDate"],
      "properties": {
        "totalPesos": { "type": ["string", "null"] },
        "totalDollars": { "type": ["string", "null"] },
        "minimumPaymentPesos": { "type": ["string", "null"] },
        "currentDueDate": { "type": ["string", "null"] },
        "nextClosingDate": { "type": ["string", "null"] },
        "nextDueDate": { "type": ["string", "null"] }
      }
    },
    "sections": {
      "type": "array",
      "items": {
        "type": "object",
        "required": ["id", "displayOrder", "label"],
        "properties": {
          "id": { "type": "string" },
          "displayOrder": { "type": "number" },
          "label": { "type": "string" }
        }
      }
    },
    "groups": {
      "type": "array",
      "items": {
        "type": "object",
        "required": ["id", "displayOrder", "label", "cardLast4", "holderName"],
        "properties": {
          "id": { "type": "string" },
          "displayOrder": { "type": "number" },
          "label": { "type": "string" },
          "cardLast4": { "type": ["string", "null"] },
          "holderName": { "type": ["string", "null"] }
        }
      }
    },
    "rows": {
      "type": "array",
      "items": { "$ref": "#/definitions/cardStatementRow" }
    },
    "futureInstallmentsBlock": {
      "type": "array",
      "description": "Issuer-provided future installment reference. These values are evidence for validation and are never added as new transactions.",
      "items": { "$ref": "#/definitions/issuerFutureInstallmentReferenceRow" }
    }
  },
  "definitions": {
    "cardStatementRow": {
      "type": "object",
      "required": ["id", "displayOrder", "sourcePage", "sectionId", "sectionLabel", "groupId", "groupLabel", "groupOrder", "rowType", "editable", "dateRaw", "dateIso", "markerRaw", "referenceRaw", "installmentRaw", "installmentCurrent", "installmentTotal", "receiptRaw", "amountPesos", "amountDollars", "currencyOriginal", "originalText", "confidence", "warnings"],
      "properties": {
        "id": { "type": "string" },
        "displayOrder": { "type": "number" },
        "sourcePage": { "type": ["number", "null"] },
        "sectionId": { "type": "string" },
        "sectionLabel": { "type": "string" },
        "groupId": { "type": ["string", "null"] },
        "groupLabel": { "type": ["string", "null"] },
        "groupOrder": { "type": ["number", "null"] },
        "rowType": { "type": "string", "enum": ["section_header", "group_header", "transaction", "group_total", "consolidated_row", "tax", "charge", "statement_total", "future_installment_reference", "legal_text", "unknown"] },
        "editable": { "type": "boolean" },
        "dateRaw": { "type": ["string", "null"] },
        "dateIso": { "type": ["string", "null"] },
        "markerRaw": { "type": ["string", "null"] },
        "referenceRaw": { "type": ["string", "null"] },
        "installmentRaw": { "type": ["string", "null"] },
        "installmentCurrent": { "type": ["number", "null"] },
        "installmentTotal": { "type": ["number", "null"] },
        "receiptRaw": { "type": ["string", "null"] },
        "amountPesos": { "type": ["string", "null"] },
        "amountDollars": { "type": ["string", "null"] },
        "currencyOriginal": { "type": "string", "enum": ["ARS", "USD", "MIXED", "UNKNOWN"] },
        "originalText": { "type": "string" },
        "confidence": { "type": ["number", "null"] },
        "warnings": { "type": "array", "items": { "type": "string" } }
      }
    },
    "issuerFutureInstallmentReferenceRow": {
      "allOf": [
        { "$ref": "#/definitions/cardStatementRow" },
        {
          "properties": {
            "rowType": { "const": "future_installment_reference" },
            "editable": { "const": false },
            "groupId": { "type": "null" },
            "groupLabel": { "type": "null" },
            "groupOrder": { "type": "null" }
          }
        }
      ]
    }
  }
}
