{
  "statementId": null,
  "source": {
    "bankName": "Banco Galicia",
    "brand": "VISA",
    "statementNumber": "VI00000000000839532",
    "pageCount": 8
  },
  "summary": {
    "totalPesos": "3118842.50",
    "totalDollars": "161.84",
    "minimumPaymentPesos": "508000.00",
    "currentDueDate": "2026-07-13",
    "nextClosingDate": "2026-07-30",
    "nextDueDate": "2026-08-07"
  },
  "sections": [
    { "id": "header", "displayOrder": 1, "label": "Encabezado" },
    { "id": "total-to-pay", "displayOrder": 2, "label": "Total a Pagar" },
    { "id": "billing-cycle", "displayOrder": 3, "label": "Ciclo de Facturación" },
    { "id": "payment-limits-rates", "displayOrder": 4, "label": "Pago Mínimo y Límites" },
    { "id": "consolidated", "displayOrder": 5, "label": "Consolidado" },
    { "id": "consumption-detail", "displayOrder": 6, "label": "Detalle del Consumo" },
    { "id": "charges-and-taxes", "displayOrder": 7, "label": "Cargos e Impuestos" },
    { "id": "statement-total", "displayOrder": 8, "label": "Total del Resumen" },
    { "id": "plan-v", "displayOrder": 9, "label": "Plan V" },
    { "id": "future-installments", "displayOrder": 10, "label": "Cuotas a Vencer" },
    { "id": "legal-text", "displayOrder": 11, "label": "Texto Legal" }
  ],
  "groups": [
    { "id": "g-6792", "displayOrder": 1, "label": "TARJETA 6792 Total Consumos de JAVIER SEB CORBELLA", "cardLast4": "6792", "holderName": "JAVIER SEB CORBELLA" },
    { "id": "g-5884", "displayOrder": 2, "label": "TARJETA 5884 Total Consumos de EMILSE RITA JIMENEZ", "cardLast4": "5884", "holderName": "EMILSE RITA JIMENEZ" },
    { "id": "g-4255", "displayOrder": 3, "label": "TARJETA 4255 Total Consumos de JAVIER SEB CORBELLA", "cardLast4": "4255", "holderName": "JAVIER SEB CORBELLA" },
    { "id": "g-0015", "displayOrder": 4, "label": "TARJETA 0015 Total Consumos de LUCAS SALVA JIMENEZ", "cardLast4": "0015", "holderName": "LUCAS SALVA JIMENEZ" }
  ],
  "rows": [
    { "id": "r-h1", "displayOrder": 1, "sourcePage": 1, "sectionId": "header", "sectionLabel": "Encabezado", "groupId": null, "groupLabel": null, "groupOrder": null, "rowType": "section_header", "editable": false, "dateRaw": null, "dateIso": null, "markerRaw": null, "referenceRaw": "Resumen de Cuenta", "installmentRaw": null, "installmentCurrent": null, "installmentTotal": null, "receiptRaw": null, "amountPesos": null, "amountDollars": null, "currencyOriginal": "UNKNOWN", "originalText": "Banco Galicia - Resumen de Cuenta VISA", "confidence": 1.0, "warnings": [] },

    { "id": "r-ttp1", "displayOrder": 2, "sourcePage": 1, "sectionId": "total-to-pay", "sectionLabel": "Total a Pagar", "groupId": null, "groupLabel": null, "groupOrder": null, "rowType": "consolidated_row", "editable": false, "dateRaw": null, "dateIso": null, "markerRaw": null, "referenceRaw": "TOTAL A PAGAR", "installmentRaw": null, "installmentCurrent": null, "installmentTotal": null, "receiptRaw": null, "amountPesos": "3118842.50", "amountDollars": "161.84", "currencyOriginal": "MIXED", "originalText": "TOTAL A PAGAR $ 3.118.842,50 / USD 161,84", "confidence": 1.0, "warnings": [] },
    { "id": "r-ttp2", "displayOrder": 3, "sourcePage": 1, "sectionId": "total-to-pay", "sectionLabel": "Total a Pagar", "groupId": null, "groupLabel": null, "groupOrder": null, "rowType": "consolidated_row", "editable": false, "dateRaw": null, "dateIso": null, "markerRaw": null, "referenceRaw": "Pago Mínimo", "installmentRaw": null, "installmentCurrent": null, "installmentTotal": null, "receiptRaw": null, "amountPesos": "508000.00", "amountDollars": null, "currencyOriginal": "ARS", "originalText": "Pago Mínimo $ 508.000,00", "confidence": 1.0, "warnings": [] },

    { "id": "r-bc1", "displayOrder": 4, "sourcePage": 1, "sectionId": "billing-cycle", "sectionLabel": "Ciclo de Facturación", "groupId": null, "groupLabel": null, "groupOrder": null, "rowType": "consolidated_row", "editable": false, "dateRaw": null, "dateIso": null, "markerRaw": null, "referenceRaw": "Cierre", "installmentRaw": null, "installmentCurrent": null, "installmentTotal": null, "receiptRaw": null, "amountPesos": null, "amountDollars": null, "currencyOriginal": "UNKNOWN", "originalText": "Cierre: 30/06/2026 - Vencimiento: 13/07/2026", "confidence": 1.0, "warnings": [] },

    { "id": "r-plr1", "displayOrder": 5, "sourcePage": 1, "sectionId": "payment-limits-rates", "sectionLabel": "Pago Mínimo y Límites", "groupId": null, "groupLabel": null, "groupOrder": null, "rowType": "consolidated_row", "editable": false, "dateRaw": null, "dateIso": null, "markerRaw": null, "referenceRaw": "Límite de Compra", "installmentRaw": null, "installmentCurrent": null, "installmentTotal": null, "receiptRaw": null, "amountPesos": "5000000.00", "amountDollars": null, "currencyOriginal": "ARS", "originalText": "Límite de Compra $ 5.000.000,00", "confidence": 1.0, "warnings": [] },
    { "id": "r-plr2", "displayOrder": 6, "sourcePage": 1, "sectionId": "payment-limits-rates", "sectionLabel": "Pago Mínimo y Límites", "groupId": null, "groupLabel": null, "groupOrder": null, "rowType": "consolidated_row", "editable": false, "dateRaw": null, "dateIso": null, "markerRaw": null, "referenceRaw": "TNA", "installmentRaw": null, "installmentCurrent": null, "installmentTotal": null, "receiptRaw": null, "amountPesos": null, "amountDollars": null, "currencyOriginal": "UNKNOWN", "originalText": "TNA 88,00% - TEA 132.32%", "confidence": 1.0, "warnings": [] },

    { "id": "r-6792-1", "displayOrder": 7, "sourcePage": 2, "sectionId": "consumption-detail", "sectionLabel": "Detalle del Consumo", "groupId": "g-6792", "groupLabel": "TARJETA 6792", "groupOrder": 1, "rowType": "transaction", "editable": true, "dateRaw": "09-Jun-26", "dateIso": "2026-06-09", "markerRaw": "*", "referenceRaw": "DLO*AMAZON MUSIC", "installmentRaw": null, "installmentCurrent": null, "installmentTotal": null, "receiptRaw": "003611", "amountPesos": "8303.49", "amountDollars": null, "currencyOriginal": "ARS", "originalText": "09-06-26 * DLO*AMAZON MUSIC 003611 8.303,49", "confidence": 0.95, "warnings": [] },
    { "id": "r-6792-t", "displayOrder": 8, "sourcePage": 2, "sectionId": "consumption-detail", "sectionLabel": "Detalle del Consumo", "groupId": "g-6792", "groupLabel": "TARJETA 6792", "groupOrder": 1, "rowType": "group_total", "editable": false, "dateRaw": null, "dateIso": null, "markerRaw": null, "referenceRaw": "Total TARJETA 6792", "installmentRaw": null, "installmentCurrent": null, "installmentTotal": null, "receiptRaw": null, "amountPesos": "8303.49", "amountDollars": "0.00", "currencyOriginal": "MIXED", "originalText": "TARJETA 6792 Total Consumos de JAVIER SEB CORBELLA 8.303,49 0,00", "confidence": null, "warnings": [] },

    { "id": "r-5884-1", "displayOrder": 9, "sourcePage": 3, "sectionId": "consumption-detail", "sectionLabel": "Detalle del Consumo", "groupId": "g-5884", "groupLabel": "TARJETA 5884", "groupOrder": 2, "rowType": "transaction", "editable": true, "dateRaw": "15-Nov-25", "dateIso": "2025-11-15", "markerRaw": "*", "referenceRaw": "JUANITA JO", "installmentRaw": "08/09", "installmentCurrent": 8, "installmentTotal": 9, "receiptRaw": "000563", "amountPesos": "58055.55", "amountDollars": null, "currencyOriginal": "ARS", "originalText": "15-11-25 * JUANITA JO 08/09 000563 58.055,55", "confidence": 0.9, "warnings": [] },
    { "id": "r-5884-2", "displayOrder": 10, "sourcePage": 3, "sectionId": "consumption-detail", "sectionLabel": "Detalle del Consumo", "groupId": "g-5884", "groupLabel": "TARJETA 5884", "groupOrder": 2, "rowType": "transaction", "editable": true, "dateRaw": "23-Mar-26", "dateIso": "2026-03-23", "markerRaw": "*", "referenceRaw": "GRANDES TIENDAS SAN JU", "installmentRaw": "03/03", "installmentCurrent": 3, "installmentTotal": 3, "receiptRaw": "003731", "amountPesos": "33922.66", "amountDollars": null, "currencyOriginal": "ARS", "originalText": "23-03-26 * GRANDES TIENDAS SAN JU 03/03 003731 33.922,66", "confidence": 0.9, "warnings": [] },
    { "id": "r-5884-3", "displayOrder": 11, "sourcePage": 3, "sectionId": "consumption-detail", "sectionLabel": "Detalle del Consumo", "groupId": "g-5884", "groupLabel": "TARJETA 5884", "groupOrder": 2, "rowType": "transaction", "editable": true, "dateRaw": "09-May-26", "dateIso": "2026-05-09", "markerRaw": "*", "referenceRaw": "M Y S", "installmentRaw": "02/03", "installmentCurrent": 2, "installmentTotal": 3, "receiptRaw": "008078", "amountPesos": "9500.00", "amountDollars": null, "currencyOriginal": "ARS", "originalText": "09-05-26 * M Y S 02/03 008078 9.500,00", "confidence": 0.9, "warnings": [] },
    { "id": "r-5884-4", "displayOrder": 12, "sourcePage": 3, "sectionId": "consumption-detail", "sectionLabel": "Detalle del Consumo", "groupId": "g-5884", "groupLabel": "TARJETA 5884", "groupOrder": 2, "rowType": "transaction", "editable": true, "dateRaw": "16-May-26", "dateIso": "2026-05-16", "markerRaw": "*", "referenceRaw": "M Y S", "installmentRaw": "02/03", "installmentCurrent": 2, "installmentTotal": 3, "receiptRaw": "008229", "amountPesos": "18333.33", "amountDollars": null, "currencyOriginal": "ARS", "originalText": "16-05-26 * M Y S 02/03 008229 18.333,33", "confidence": 0.9, "warnings": [] },
    { "id": "r-5884-5", "displayOrder": 13, "sourcePage": 3, "sectionId": "consumption-detail", "sectionLabel": "Detalle del Consumo", "groupId": "g-5884", "groupLabel": "TARJETA 5884", "groupOrder": 2, "rowType": "transaction", "editable": true, "dateRaw": "26-May-26", "dateIso": "2026-05-26", "markerRaw": "*", "referenceRaw": "DEL PUEBLO BARRIO NORTE", "installmentRaw": "02/03", "installmentCurrent": 2, "installmentTotal": 3, "receiptRaw": "005079", "amountPesos": "6545.26", "amountDollars": null, "currencyOriginal": "ARS", "originalText": "26-05-26 * DEL PUEBLO BARRIO NORTE 02/03 005079 6.545,26", "confidence": 0.9, "warnings": [] },